{"authorization_id":"auth-1","candidate_digest":"sha256:b54967fc908149766c71e5281482981b803069284a104b6458d6efd5dd3bedbb","created_at":"2026-08-05T09:00:00Z","evidence_digest":"sha256:9f2d76050755f66315c7b0900d9fcd5c395385b97c7b793c592881c431c6b26a","execution":{"acknowledged":true,"acknowledged_at":"2026-08-05T00:00:05Z","exit_status":0},"receipt_id":"r-1","replay":{"mode":"recompute-decision"},"result":{"matched_rule":"tests-green-on-main","outcome":"ALLOW","reasons":[{"code":"rule_allow","message":"Tests green on main within freshness bound.","rule_id":"tests-green-on-main"}],"trace":["0:tests-green-on-main:true"]},"rulebook":{"digest":"sha256:eb851f1c213105876977484d3f41cd724811819fc65044a0c87cd29c829570ee","rulebook_id":"pipeline-gate","version":"1.0.0"},"signature":{"alg":"ed25519","key_id":"receipt-key","key_version":1,"value":"9PN9Q4FRBuC90fSOAbSP8tCpQNHUNDc+h5SI0hlUe4cnWUmrgyhX4RNXYHdo51GhXDoEsU8TfEPBrIOyelVcDA=="},"spec_version":"1"}