{"candidate_digest":"sha256:e5ff039b589b7441d1b587628baa1d843313a7d542be6eda811dd9295cf3a133","created_at":"2026-08-05T00:00:06Z","evidence_digest":"sha256:b8871d3df9bed874019901f13bffeb7f7bf992efbfbe7cb8abb4763f163de771","receipt_id":"r-1","replay":{"mode":"recompute-decision"},"result":{"matched_rule":"no-destructive-shell","outcome":"BLOCK","reasons":[{"code":"rule_block","message":"Destructive shell commands are never allowed.","rule_id":"no-destructive-shell"}],"trace":["0:no-destructive-shell:true"]},"rulebook":{"digest":"sha256:dfaeec83d2c67e3c56e0efc330a801edf727dcc0269c2325f81e80e87c8784aa","rulebook_id":"agent-guard","version":"1.0.0"},"signature":{"alg":"ed25519","key_id":"receipt-key","key_version":1,"value":"tLwxGTwqsqP/4z8BR4WpcK0caa0C9jiJ+IxTcb1HpOJRytpDMmoq8wNpo0SNt8FkIFkp7CdXMlH+YvLUmm6CDg=="},"spec_version":"1"}