{"candidate_digest":"sha256:686e03dc2e7d6bd1e33cae7fcd9c973012914ee2a7bef06734f94d4e0521db5e","created_at":"2026-08-05T00:00:06Z","evidence_digest":"sha256:9d76fb43cf84953594609534e198a1d597ac75ee385f4e635f48f9ebd869a461","receipt_id":"r-1","replay":{"mode":"recompute-decision"},"result":{"matched_rule":"over-authority","outcome":"HOLD","reasons":[{"code":"rule_hold","message":"Amount exceeds this adjuster's declared authority; route to named escalation.","rule_id":"over-authority"}],"trace":["0:over-authority:true"]},"rulebook":{"digest":"sha256:623eb952567e387fa8f713c9a70a12de9764d2a05e6cb5a528998f4336aba922","rulebook_id":"claims-gate","version":"1.0.0"},"signature":{"alg":"ed25519","key_id":"receipt-key","key_version":1,"value":"7TpLTfhK+Ev7CmYerDtC6XUpMzk/nufkRu9uEOETiH827W5SpgbwbT6j9lVAaTYrzJhfq3V/HtjT6V9Z6uRbBQ=="},"spec_version":"1"}